{
  "methodology_version": "4.0",
  "idea_id": "fixture-app",
  "analysis_date": "2026-07-10",
  "mode": "quick",
  "stage": "desk_research",
  "target_segment": "US consumers",
  "target_geos": ["US"],
  "primary_archetype": "consumer_utility",
  "product_type": "app",
  "risk_modifiers": [],
  "dimensions": {
    "problem_demand": {"low": 3, "base": 3, "high": 3, "claim_ids": ["claim-demand"]},
    "monetization_economics": {"low": 3, "base": 3, "high": 3, "claim_ids": ["claim-economics"]},
    "competitive_wedge": {"low": 3, "base": 3, "high": 3, "claim_ids": ["claim-wedge"]},
    "distribution_access": {"low": 3, "base": 3, "high": 3, "claim_ids": ["claim-demand"]},
    "repeat_value_retention": {"low": 3, "base": 3, "high": 3, "claim_ids": ["claim-economics"]},
    "timing": {"low": 3, "base": 3, "high": 3, "claim_ids": ["claim-wedge"]},
    "liquidity_cold_start": null
  },
  "opportunity": {"low": 60, "base": 60, "high": 60, "classification": "attractive"},
  "fatal_gates": [
    {"code": "LEGAL_BLOCKED", "status": "clear", "evidence_ids": ["demand-metric"]},
    {"code": "CORE_FEASIBILITY_BLOCKED", "status": "clear", "evidence_ids": ["economics-metric"]},
    {"code": "PLATFORM_BLOCKED", "status": "clear", "evidence_ids": ["wedge-metric"]},
    {"code": "SAFETY_ETHICS_BLOCKED", "status": "clear", "evidence_ids": ["demand-metric"]}
  ],
  "riskiest_assumptions": [
    {"claim_id": "claim-demand", "category": "value", "impact": 3, "uncertainty": 3, "claim_grade": "B", "product_specific_evidence_ids": [], "disposition": "supported"},
    {"claim_id": "claim-economics", "category": "business_viability", "impact": 3, "uncertainty": 2, "claim_grade": "B", "product_specific_evidence_ids": [], "disposition": "supported"},
    {"claim_id": "claim-wedge", "category": "usability", "impact": 2, "uncertainty": 3, "claim_grade": "B", "product_specific_evidence_ids": [], "disposition": "partial"}
  ],
  "overall_evidence_grade": "B",
  "decision": "TEST_ONCELIKLI",
  "status": "PREBUILD_PENDING",
  "next_test": "Run a refundable-deposit test",
  "stopping_rule": "Close after the preregistered sample target",
  "post_mvp_result": null
}
